{
  "schema_version": "1.0.0",
  "envelope_id": "0192f3a4-0000-7000-8000-000000000103",
  "run_id": "run-0000",
  "source": {
    "kind": "EXTERNAL_DOC",
    "uri": "file://.antigravity/genesis/research_briefing.md",
    "retrieved_at": "2026-10-21T01:00:00Z"
  },
  "trust_level": "UNTRUSTED_ENVELOPED",
  "executable_authority": "NONE_DATA_ONLY",
  "sanitization": {
    "redaction_profile": "kernel.secret_scan.v1",
    "secrets_redacted_count": 0,
    "matched_secret_classes": [],
    "prompt_injection_stripped_count": 0,
    "matched_injection_patterns": [],
    "quarantine_recommended": false
  },
  "raw_sha256": "sha256:dd8b8ef879774158ed727a49111617074358abe8fb54ec11b5d505aa02a7bf61",
  "sanitized_text": "# NotebookLM Research Briefing: Meta-OS Universal Ignite & Cockpit Suite\n\n## 1. Executive Synthesis\nMeta-OS v1.2 requires a hermetic Layer B suite (`metaos_ignite`) so any cloned repository can bind one of the 6 universal archetypes (`Backend_API`, `FullStack_Web`, `Data_ML_Pipeline`, `CLI_SDK`, `Autonomous_Agent`, `Embedded_IoT`), sanitize untrusted research inputs via `UntrustedContentEnvelope` (`I-14`), execute Triple RED/GREEN verification inside `/tmp` git worktrees (`I-09`, `V12-05`), assemble signed `ProofReceipt` packages with `Meta-Metrics` (`I-10`), and project zero-token Obsidian + Mermaid dashboards (`I-07`).\n\n## 2. Extracted Claims (Unverified Until Contract & Test Gates)\n- CLM-0001: All 6 archetypes share a uniform LanguageToolchainPort and polymorphic security/performance proof labels (`ArchetypeSecurityScanProof`, `ArchetypePerformanceScanProof`).\n- CLM-0002: NotebookLM research briefings must pass through `UntrustedContentEnvelope` before any `IntentContract` synthesis.\n- CLM-0003: Triple RED Oracle (`V12-05`) requires `CompilationSuccess == true`, `RuntimeExecution == \"EXECUTED\"`, `TestExitCode != 0`, `oracle_id` binding, and identical failure sets across two seeded runs.\n- CLM-0004: Obsidian Vault views (`DASHBOARD.md`, `STATE_GRAPH.md`, `DECISION_QUEUE.md`, `EVIDENCE_LEDGER.md`) are pure deterministic projections (`I-07`) with `[[wikilink]]` graph edges and Mermaid state diagrams.\n",
  "extracted_claims": [
    {
      "claim_id": "CLM-0001",
      "statement": "Uniform LanguageToolchainPort across 6 archetypes.",
      "evidence_status": "UNVERIFIED"
    },
    {
      "claim_id": "CLM-0002",
      "statement": "UntrustedContentEnvelope mandatory before IntentContract synthesis.",
      "evidence_status": "UNVERIFIED"
    },
    {
      "claim_id": "CLM-0003",
      "statement": "Triple RED Oracle V12-05 with dual seeded replay stability.",
      "evidence_status": "UNVERIFIED"
    },
    {
      "claim_id": "CLM-0004",
      "statement": "Zero-token Obsidian wikilink and Mermaid cockpit projection.",
      "evidence_status": "UNVERIFIED"
    }
  ],
  "content_hash": "sha256:9ce513bdaf98351f7a7356e95ef0d44fdebe0ec7c6276009f61f6ac872aa42dc",
  "signature": {
    "alg": "sshsig-ed25519",
    "key_id": "SHA256:KSJqN7E/iGFtcl/3WP127Fvx2VymIDu3/sl717oOJDU",
    "namespace": "metaos.kernel",
    "sig": "-----BEGIN SSH SIGNATURE-----\nU1NIU0lHAAAAAQAAADMAAAALc3NoLWVkMjU1MTkAAAAg7ui/ox50u7aNUZSlzF/DoneDMa\ndG7e0nmfNjWm4MzecAAAANbWV0YW9zLmtlcm5lbAAAAAAAAAAGc2hhNTEyAAAAUwAAAAtz\nc2gtZWQyNTUxOQAAAECATsYfThblwbagBDPP8Ipn8VPof1yHjw2ImEu9YBRwWQ8I5qTe8n\ntFfV4UJjhPU74IuIwxh1lV05T+Y/3RiooN\n-----END SSH SIGNATURE-----"
  }
}
